dates,titles,text
08/11/2022,The purchase of student accommodation provider Student Roost by GIC and Greystar could lead to higher rent and lower quality housing for students in Birmingham.,"
    
          The Competition and Markets Authority’s (CMA) phase 1 assessment looked at how the proposed deal could impact students and universities across the UK, focusing on cities where GIC, Greystar and Student Roost have a significant combined presence.

The CMA found the acquisition would not lead to competition concerns in most cities because the combined businesses would continue to face sufficient competition from other accommodation providers. But in Birmingham, the CMA found that the combined businesses would not face enough competition across several university campuses, potentially resulting in higher prices and lower quality services for students.

GIC, Greystar and Student Roost have accepted the acquisition could raise competition concerns in Birmingham and intend to offer remedies to fully address them. The CMA expects to receive their formal proposal within the next 5 working days. Provided the proposed remedy addresses the CMA’s concerns, the merger will be cleared without the need for an in-depth phase 2 investigation.

Colin Raftery, Senior Mergers Director at the CMA, said:


  Aside from fees, rent is the biggest expense students face, and the rising cost of living is putting even more pressure on student budgets.

  Many university towns and cities are already dealing with a student accommodation shortage, which is why it’s crucial that private providers like those involved in this deal are competing effectively.

  We’re concerned this deal could result in students in Birmingham seeing higher prices or lower quality services. GIC, Greystar, and Student Roost have accepted our concerns and have told us that they plan address them. A solution that fully resolves our concerns will avoid the need for a more in-depth investigation.


For more information visit the GIC Realty / Greystar / Student Roost case page.

Notes to editors:

A detailed summary of the CMA’s decision is available on the case page. The full text of the decision setting out the CMA’s investigation and analysis will be published in due course.
  The CMA’s competition concerns relate to 15 university campuses in Birmingham.
  The parties have until 15 November to submit proposals to address the CMA’s competition concerns. The CMA would then have until 22 November to consider whether to accept these in principle or refer the deal for an in-depth phase 2 investigation.
  All enquiries from journalists should be directed to the CMA press office by email on press@cma.gov.uk or by phone on 020 3738 6460.
  All enquiries from the general public should be directed to the CMA’s General Enquiries team on general.enquiries@cma.gov.uk or 020 3738 6000.
"
27/10/2021,"Land Trust charity benefits by £30,000 to improve environment.","
    
          Inspectors found excessive amounts of sludge had been spread without notification
  Two other companies issued with Variable Monetary Penalties
The Environment Agency has accepted an Enforcement Undertaking (EU) from a company who spread excessive amounts of sewage sludge on land near Doncaster contrary to the Environmental Permitting (England & Wales) Regulations 2016.

The Environment Agency also issued variable monetary penalties (VMPs) totalling over £10,000 to 2 other companies for breaches of the Nitrate Pollution Prevention Regulation 2015.

The EU has been agreed after Sanderson Environmental Ltd were found to have breached conditions of their environmental permits for 2 fields at Highwood Farm, near Rossington, Doncaster. This follows an investigation which began in 2017.

The company, who operated on the land, have paid costs of £8,137.36 and have made a donation of £30,000 to the Land Trust, a registered charity which works to improve former coalfield sites across Yorkshire.

When officers from the Environment Agency inspected the farm to check compliance with environmental permits they found that excessive amounts of sludge had been imported.

They also found that spreading had occurred to land on a large scale without notification to the Environment Agency. Enquiries revealed that the sewage sludge had not been treated prior to spreading.

When challenged by Environment Agency officers the company eventually stopped operating and all remaining stockpiled sewage sludge was removed. A crop of contaminated peas planted in error by the landowners was destroyed.

Two companies who own the fields in question were issued with VMPs for breaches of the Nitrate Pollution Prevention Regulation 2015.

Sutcliffe Farmers Limited paid £7,521.54 and Senviro Limited paid £2,507.73, with each also paying costs of £8,137.63. A VMP is a proportionate monetary penalty for the more serious cases of non-compliance.

A spokesperson for the Environment Agency said:


  We take our responsibility to protect the environment very seriously. Where there is evidence, the Environment Agency uses a full range of enforcement options.

  Enforcement Undertakings allow businesses who fail to comply with legal requirements or pollute the environment to come into compliance.

  The Environment Agency is increasingly using this method of enforcement where there is opportunity to restore and improve the environment, change behaviour and improve practices of the offender.

  We rely on communities to report pollution and environmental issues to us, and urge people to report issues to us on our 24 hour incident hotline on 0800 80 70 60.


Euan Hall, the chief executive for The Land Trust, said:


  This award has made a huge difference to the sites on our South Yorkshire portfolio.

  We have already been able to deliver a number of projects which have been of huge benefit to the communities that live and work around our sites.

  We are very pleased to have been able to help the Environment Agency undo some of the damage that had been done and make improvements that will benefit the local area for the long-term.


Notes to editor

What is an enforcement undertaking (EU)?

An EU is available to the Environment Agency as an alternative sanction to prosecution or monetary penalty for dealing with certain environmental offences.

It is a legally-binding voluntary agreement proposed by a business (or an individual) when the EA has reasonable grounds to suspect that an environmental offence has occurred.

EUs for environmental offences were introduced under the Environmental Civil Sanctions (England) Order 2010 and the Environmental Civil Sanctions (Miscellaneous Amendments) (England) Regulations 2010.

Why use enforcement undertakings?

businesses will voluntarily secure compliance now and in the future, without attracting a criminal record
  the environment, local community and those directly impacted by the offending can benefit through actions being offered in an EU
  they allow us to deal with the less intentional and polluting offending in a more proportionate way than prosecution through the criminal courts
  EUs go beyond the bare minimum needed for a business to comply, as shown in the list of accepted EUs we publish on our website
How can businesses benefit from enforcement undertakings instead of prosecution?

Accepting an EU is always at the discretion of the EA. But if accepted replaces the need for an alternative sanction, such as prosecution or monetary penalty.

The EA has produced guidance and standard forms to help those wishing to make offers.

However, we expect responsible businesses to co-operate and seek our advice at an early stage, as we are more likely to accept EUs which have been offered early or proactively.

When offering an EU, businesses must accept responsibility for the offending.

They must also include actions which will stop offending, ensure future compliance and protect any harm/damage.

They must also make a financial contribution towards a suitable environmental project.

What is a variable monetary penalty (VMP)?

A VMP is a proportionate monetary penalty for the more serious cases of non-compliance.

How much is a VMP?

The maximum amount for any VMP is £250,000 for each offence.  The exact amount is calculated using the methodology in Annex 1 of our Enforcement and Sanctions Policy.

When can VMPs be used?

A VMP can be used in the following situations:

when there is evidence of negligence or mismanagement
  when there is an environmental impact
  to remove an identifiable financial gain or saving as a result of the breach
  where it is not in the public interest to prosecute
What happens to the money once the VMP has been paid?

The money is transferred to Her Majesty’s Treasury – the Environment Agency does not keep the money to fund its own activities or have a say in how the money is used.  The Environment Agency is however, able to recover its costs, using an Enforcement Cost Recovery Notice.


"
30/08/2017,The CCS G-Cloud framework helps save DWP an estimated £20 million per year.,"
    
          
The Department for Work and Pensions (DWP) introduced the ‘Tell Us Once’ system back in 2011 to make it easier for people to inform the government about a change in their personal circumstances.

Using ‘Tell Us Once’, departments and agencies like Her Majesty’s Revenue and Customs, the Passport Office and local authorities are informed about a person’s change in circumstances in parallel, removing the need for repeated, unnecessary form-filling.

DWP was paying for physical hosting of the service through a single, non-extendable, managed contract.

Faced with the hard stop of the existing contract, the emerging Government Digital Agenda and the need to drive down costs, DWP needed a solution that would move from a physical hosted system to a commodity cloud-based solution.

A simple process with effective outcomes

Timescales were tight for DWP, who had only an 8-month delivery window.

The department had no in-house experience to conduct a physical to virtual cloud transition; so they took the decision to bring in external support through CCS’s G-Cloud framework, which is hosted on the Digital Marketplace.

By following the steps in the simple buying process - listing requirements, key word searches, reviewing service offerings and applying filters to reach a short list - DWP was able to to hold a supplier open day.

In just 8 weeks, digital technology specialists Kainos were awarded the contract.

Kainos guided the DWP project team through the transition to cloud. Having a really experienced transition manager was crucial to the success of the project.

A ‘lift and shift’ approach was taken to move from the current incumbent physical state to a virtual state hosted by UKCloud.

Kainos took advantage of the fact that the go-live date was scheduled for 29 August 2016 - a bank holiday everywhere except in Scotland. The company took the small amount of live data received on this day and carried out user assurance, rolling the system out to the rest of the UK subsequently.

Working through the bank holiday and utilising traditional ‘down days’, the supplier was able to test their solution before full roll-out.

The result

Cutting administration costs and reducing the overpayments of benefits - usually because of out-of-date records of people’s personal circumstances - protected the cross-government savings generated by Tell Us Once, estimated at more than £20 million per year.

By switching from a physical infrastructure to a cloud solution, DWP has also benefited from cost savings of around 50% on the IT running costs of Tell Us Once.

The solution is also scalable and flexible, giving assurance that the department will be ready to grow and change it as circumstances demand.

Why G-Cloud?

We asked DWP what they would suggest to other buyers to consider when looking for a similar requirement.

Fidelma Holland, Strategic Design, Planning and Quality Lead for Tell Us Once explains:

“Engage with the market before you draw up service requirements. Suppliers are happy to provide advice on what you need to think about in terms of scope of requirement and the offering.

“Be realistic with delivery timescales and budget. Suppliers know and understand the art of the possible.

“Be inclusive with the supplier. Get them to spend time with service ‘front end’ so they can appreciate the impact on end users of what they are transitioning.

“And work hard at the relationship. Make them feel part of your team, it will pay dividends.

“Using G-Cloud was crucial in ensuring we got what we wanted in a very short timescale.”

Russell Sloan, Head of Digital Services at Kainos said:

“Cloud adoption is key to achieving significant savings in the running costs of important services like Tell Us Once as well as providing the flexibility and security to continue leveraging this, and other services, in the future.

“Following an efficient G-Cloud procurement, Kainos was delighted to be selected to work collaboratively with DWP on this project and again deliver on schedule, with a highly successful outcome being realised by DWP.”

Get involved
To find out more about the G-Cloud agreement and how you can make significant savings visit the Digital Marketplace.



"
07/04/2022,The CMA has appointed Sorcha O’Carroll as its new Senior Director of Mergers.,"
    
          Sorcha has worked as a Director of Mergers at the Competition and Markets Authority (CMA) since 2019 and replaces Joel Bamford who left in February. Her appointment follows an open recruitment process that attracted applications from a strong field of candidates.

As Senior Director of Mergers, Sorcha will be the decision-maker on complex Phase 1 merger cases, as well as overseeing the merger team’s work across both Phase 1 and 2 inquiries. Following the UK’s exit from the EU, the CMA has taken on responsibility for merger cases that were previously reserved for the European Commission, which are typically larger and more complex.

Sorcha will work alongside Colin Raftery, who is also a Senior Director in the mergers team, and report to David Stewart, Executive Director for Markets and Mergers.

David Stewart, Executive Director for Markets and Mergers at the CMA, said:


  It’s a pleasure to welcome someone of Sorcha’s experience and acumen to the CMA’s senior leadership team. Everyone who works with Sorcha knows that she brings enormous strengths to our mergers work. Her analytical skill and strategic judgment will be vital in this critical role, as the CMA continues to build on its strong track record as a world-class competition authority.


On her appointment, Sorcha said:


  I’m delighted to accept this role at a time when the CMA is taking on more complex merger inquiries than ever before.

  Competition has an important role in delivering the best possible outcomes for people across the UK; this is especially important as the cost of living rises.

  I look forward to working closely with Colin, David and the rest of the CMA’s renowned mergers team as we investigate deals to ensure that they do not undermine competition and leave people worse off.


Sorcha took up her appointment on 1 April 2022. Before joining the CMA, she worked in private practice in the UK and Canada.

Notes to editors

This appointment was managed by a Civil Service Commissioner to ensure a fair, merit-based, and open process, in keeping with the Civil Service Recruitment Principles.
  The role was advertised publicly with applicants being asked to submit an application form and cover letter detailing their suitability for the role, as measured against a published role profile with a set of required skills and experience.
  For media queries, please contact the press office via press@cma.gov.uk or on 020 3738 6460.
"
26/01/2022,"The CMA has secured improvements for Xbox online players, following concerns about Microsoft’s use of auto-renewing subscriptions for online gaming services.","
    
          The changes relate to Microsoft’s practices in relation to the automatic renewal of contracts for online gaming services. Microsoft’s Xbox Live Gold and Game Pass products allow people to access a library of games and play together online. They are offered as memberships which are often entered into on an auto-renewal basis. This means that membership is automatically rolled over at the end of each contract period and the customer charged unless they actively take steps to stop the subscription.

As part of an investigation into the online console video gaming sector the Competition and Markets Authority (CMA) identified concerns about certain features of Microsoft’s auto-renewing subscriptions, in particular: whether it was clear upfront that contracts would automatically renew; how easy it was to turn off automatic renewal; and whether people may not have realised they were still paying for services they no longer used.

The CMA has secured undertakings with Microsoft which are designed to address these concerns. The improvements include:


    Better upfront information: Microsoft will provide more transparent, upfront information to help customers understand their Xbox membership – making clear, for example, that the subscription will auto-renew unless the customer turns off auto-renewal; when the subscription will auto-renew; how much it will cost; and how the customer can receive a refund after an accidental renewal
  
  
    Refunds: Microsoft will contact existing customers on recurring 12-month contracts and give them the option to end their contract and claim a pro-rata refund
  
  
    Inactive memberships: Microsoft will also contact existing customers who haven’t used their memberships for a long time but are still paying. These customers will be reminded how to stop payments, and if they continue not to use their memberships, Microsoft will ultimately stop taking further payments
  
  
    Better information about price increases: Microsoft will give clearer notifications of any future price rises, and will ensure people know how to turn off auto-renewal if they don’t want to pay the higher price
  
Michael Grenfell, Executive Director of Enforcement at the CMA, said:


  Gamers need to be given clear and timely information to make informed choices when signing up for auto-renewing memberships and subscriptions. We are therefore pleased that Microsoft has given the CMA these formal undertakings to improve the fairness of their practices and protect consumers, and will be offering refunds to certain customers.

  Other companies offering memberships and subscriptions that auto-renew should take note, and review their practices to ensure they comply with consumer protection law.



Full details of the undertakings are available on the CMA’s website.

Notes to editors

For media enquiries, contact the CMA press office on 020 3738 6460 or press@cma.gov.uk.
  Microsoft, as referred above, consists of Microsoft Limited and Microsoft Ireland Operations Limited.
  The undertakings apply to contracts between Microsoft and consumers for the supply of Xbox Live Gold, Game Pass and Game Pass Ultimate (or any online video gaming product which replaces, rebrands or includes these products) which are associated with a console and subject to auto-renewal.
  For the avoidance of doubt, the offering of these undertakings is not an admission that any person or firm has breached the law. Only a court can decide whether a breach has occurred.
  An undertaking is a voluntary agreement a firm makes to address an enforcement authority’s concerns and resolve an investigation without the need for court action.
  The key pieces of consumer protection legislation relevant to the CMA’s investigation are: the Consumer Protection from Unfair Trading Regulations 2008 (CPRs); Part 2 of the Consumer Rights Act 2015 (CRA); and the Consumer Contracts (Information, Cancellation and Additional Charges) Regulations 2013 (CCRs). The CPRs contain a general prohibition against unfair commercial practices and specific prohibitions against misleading actions, misleading omissions and aggressive commercial practices. Part 2 of the CRA aims to protect consumers against unfair contract terms and notices, and requires contract terms to be fair and transparent. The CCRs regulate the information that should be provided to consumers before they make a purchase, cancellation rights for certain contracts and the use of pre-ticked boxes for additional payments.
"
19/07/2011,Solar powered technology funded by UK aid brings light to rural Pakistan,"
    
          
A bright idea

Marvi may not look like an early adopter of the latest technology but, thanks to UK aid, she is reaping the benefits of a very practical gadget - a multi-purpose solar light. 

“I use the solar light for cooking at night,” she explains. “We save money because we had to buy candles and kerosene before. We also use it to charge our mobile phones.”

Power to the people

Yousaf Babar village in rural Sindh province, where Marvi and her 7 children live, has had no electricity since the floods last year, and the villagers have had to spend what little money they had on candles, kerosene oil, and rechargeable torches, instead of food.

As part of the UK’s response to the floods, DFID has provided 12,000 innovative solar light units to people in Yousaf Babar and other villages across southern Pakistan. This is the first time DFID has invested in solar technology as part of the UK’s response to a disaster.

The solar lights cost about £10 per unit and give sustainable, free light for up to 10 hours after each charge, and can last for up to 5 years. The cost is recouped within a couple of months, providing excellent value for money.

Into the light

People who lost their homes after the devastating floods in Pakistan last year had to live in emergency camps and tent cities for months. These camps had no light, and research has shown that abuse on women and children always tends to increase, due in part to no light being available when they go to the toilet after dark. Providing simple solar powered lighting can help tackle this.

Staying in touch

Another benefit to the solar technology is recharging mobile phones, which are vital communication lifelines in rural areas. Landline telephones do not exist in much of rural Pakistan, or were destroyed in the floods, so mobile phones are essential for allowing people forced away from their homes to keep in touch with family and community. The solar light technology provided by UK aid can be adapted to charge people’s mobile phones, helping reunite displaced families and communities, and help people to try to get back to a normal life.


"
03/06/2021,"Thousands of vulnerable people, including care leavers, will get more cash to pay their rent, thanks to changes to housing benefits.","
    
          These changes are coming into force from Monday 31 May 2021 – two years earlier than scheduled.

This will offer £10 million of additional housing support, bringing the total projected government spend on housing support to £30 billion this year.

Increases to the Shared Accommodation Rate (SAR) are expected to benefit thousands of Universal Credit and Housing Benefit claimants, and have been introduced more than two years earlier than the original implementation date of October 2023.

The SAR is applied to renters aged under 35 claiming support through Local Housing Allowance (LHA). It adjusts their benefit to the cost of renting a room in shared accommodation, but there is a higher, one-bedroom rate for people who need to rent solo housing.

Changes to the Local Housing Association rate
There are two key changes:

Care leavers can now claim the higher one-bedroom LHA rate for longer, as the maximum age limit has been raised to 25, from 22.
  Anyone who has lived in a homeless hostel for 3 months or more, regardless of age, will also now be able to claim the higher rate, as the age limit has been removed.
For example, in Harlow and Stortford a single care leaver aged 23 could expect to receive up to £387 additional housing support per month as a result of the change.

Minister for Welfare Delivery Will Quince said:


  These changes are an immediate boost for some of the most vulnerable young people in our communities.



  We know that having a safe, secure home is vital to getting on your feet and often into work. By bringing these changes in early, we’re able to help more people right now, as we all look to recover from the pandemic.

"
