dates,titles,text
07/02/2023,"Over 8 million families in the UK will continue to receive direct financial support from Government, with the first of five Cost of Living Payments – worth £301 – hitting bank accounts this spring.","
    
          Over 8 million families in the UK on means-tested benefits will automatically receive £301 this Spring, and over 6.5 million people on disability benefits in the country will receive a £150 payment this summer
  £301 payment is the first of five direct cost of living payments for the most vulnerable households, including pensioners and disabled people, with the total amount of support reaching up to £1,350
  Full breakdown released showing recipients of Cost of Living and disability payments by local authority and parliamentary constituency
After confirming the payment schedule for five cost of living payments through the 2023/24 financial year, The Department for Work and Pensions (DWP) has today announced in Parliament more detail on the support.

This includes estimates of how many people across the UK, and in each local authority and parliamentary constituency, will receive the first £301 Cost of Living Payment and the £150 Disability Payment, which follows on from up to £1,200 in support for low-income households in 2022.

Work and Pensions Secretary, Mel Stride said:


  These direct payments will help people right across the UK over this year and the start of the next, as we continue to provide consistent, targeted and substantial support for the most vulnerable.

  Our wider support package, including the Energy Price Guarantee, will ensure every household is being helped through this challenging period of high inflation, caused by Putin’s illegal war and the aftershocks of the pandemic.


Chancellor of the Exchequer, Jeremy Hunt added:


  High inflation, exacerbated by Putin’s illegal war, is hurting economies across the world and making people poorer.

  These payments are the next part of the significant support we are providing through this challenging time, with millions of vulnerable households receiving £900 directly into their bank accounts this financial year alongside additional help for pensioners and those with disabilities.

  This latest payment will provide some temporary relief, but the best thing we can do to help families and businesses is to stick to the plan to halve inflation this year.


Exact payment windows and qualifying periods for eligibility will be announced in due course, but are designed to ensure a consistent support offer throughout the year. Payment windows will be broadly as follows:

£301 – First 2023/24 Cost of Living Payment – during Spring 2023
  £150 – 2023 Disability Payment – during Summer 2023
  £300 – Second 2023/24 Cost of Living Payment – during Autumn 2023
  £300 – 2023 Pensioner Payment – during Winter 2023/4
  £299 – Third 2023/24 Cost of Living Payment – during Spring 2024
There are several benefits that could make claimants eligible for the £301 Cost of Living Payment, including Universal Credit and tax credits – through which 5.4 million households across the UK are expected to qualify, and Pension Credit, through which 1.4 million pensioner households are expected to be paid. 1.3 million will be eligible through legacy DWP benefits such as Jobseekers Allowance and Income Support, reaching a total of 8.1 million households.

Eligible individuals do not need to apply for payments, as they are made automatically. Those eligible for cost of living payments through tax credits, and no other means-tested benefits, will be paid by HMRC shortly after DWP payments are made.

This builds on the government’s wider support package, which includes further funding for the Household Support Fund, bringing its total value for October 2021 to March 2024 to over £2 billion. The fund is distributed to English councils, who know their areas best and are then able to offer direct support for those most in need in their local area. Every household with a domestic electricity supply is also benefitting from the Energy Price Guarantee, which is saving the average household around £900 this winter and a further £500 in 2023/24 by capping energy costs.

Benefits will also rise in line with inflation from April, which will see a 10.1% increase for pensioners and those on the lowest incomes, whilst the National Living Wage will see its biggest ever cash rise, bringing it to £10.42 an hour.

This all follows on from 2022’s support package, which included:

A £650 Cost of Living Payment for means-tested benefit claimants, split into two payments, each of which supported over eight million households
  Further £300 and £150 payments, which reached over eight million pensioner households and six million disabled people respectively
  A £150 Council Tax rebate for all households in Council Tax bands A to D in England
  A £400 energy bill discount for all households, which will continue to run through March 2023"
03/01/2023,"Millions of the lowest-income households across the UK will get up to £1,350 from the Government in 2023/4 to help with the cost of living.","
    
          Millions will receive new cost of living support from Spring 2023, following up to £1,200 in support for over eight million low-income households in 2022
  £900 Cost of Living Payment for means-tested benefit claimants will go direct to bank accounts in three payments over the financial year
  Extra cash support for disabled people and pensioners will see some households receive extra cash
The Department for Work and Pensions (DWP) has today announced more detail on the payment schedule for the next round of cost of living support unveiled in the Chancellor’s Autumn Statement, building on payments made to over eight million people in 2022.

The new £900 cash boost for over eight million eligible means-tested benefits claimants, including those on Universal Credit, Pension Credit and tax credits, starts in Spring and will go direct to bank accounts in three payments over the course of the financial year. There will also be a separate £150 for over six million disabled people and £300 for over eight million pensioners on top of their Winter Fuel Payments.

Exact payment windows will be announced closer to the time, but are spread across a longer period to ensure a consistent support offering throughout the year. They will be broadly as follows:

£301 – First Cost of Living Payment – during Spring 2023
  £150 – Disability Payment – during Summer 2023
  £300 – Second Cost of Living Payment – during Autumn 2023
  £300 – Pensioner Payment – during Winter 2023/4
  £299 – Third Cost of Living Payment – during Spring 2024
Work and Pensions Secretary, Mel Stride said:


  We are sticking by our promise to protect the most vulnerable and these payments, worth hundreds of pounds, will provide vital support next year for those on the lowest incomes.



  The government’s wider support package has already helped more than eight million families as we continue to deal with the global consequences of Putin’s illegal war and the aftershocks of the pandemic.


Chancellor of the Exchequer, Jeremy Hunt added:


  I know these are tough times for families across the UK who are struggling to meet rising food and energy costs, driven by the aftershocks of Covid and Putin’s war in Ukraine.



  That’s why we’re putting a further £900 into the pockets of over 8 million low income households next year. These payments are on top of above inflation increases to working-age benefits and the Energy Price Guarantee, which is insulating millions from even higher global gas prices.



  Tackling inflation is this government’s number one priority and is the only way to ease the strain of high prices, drive long term economic growth and improve living standards for everyone.


If individuals are eligible they will be paid automatically, and there will be no need to apply. Claimants who are eligible for any of the Cost of Living Payments and receive tax credits, and no other means-tested benefits, will receive payment from HMRC shortly after DWP payments are issued.

These payments build on the Government’s extensive support package to help households tackle the globally rising cost of living stemming from the pandemic and the war in Ukraine.

The Government’s Energy Price Guarantee continues to cap energy costs, saving the average household around £900 this winter and a further £500 in 2023/24. Benefits, including working age benefits and the State Pension, will also rise in line with inflation from April 2023, ensuring they increase by over 10%. April will also see the biggest ever cash rise to the National Living Wage, bringing it to £10.42 an hour, and a further year-long extension of the Household Support Fund in England and associated devolved nation funding worth £1 billion in total.

This comes on top of the 2022 support package, which included:

A £650 Cost of Living payment for means-tested benefit claimants, split into two payments, each of which supported over eight million households
  Further £300 and £150 payments, which reached over eight million pensioners and over six million disabled people respectively
  A £150 Council Tax rebate for all households in Council Tax bands A-D
  A £400 energy bill discount for all households, which will continue to run through March"
11/01/2023,Financial package to help students with living costs and a further freeze on tuition fees.,"
    
          
Multimillion pound package to help students cover living and other costs.
  Tuition fees frozen for next two years to reduce student debt levels
  Measures are part of government’s drive to support households with the cost of living
Students in need are to benefit from additional financial support designed to ease cost of living pressures and help them to meet everyday costs whilst they are completing their studies.

In recognition of the challenges some students have faced due to the global rise in inflation, the government has announced today (11 January) that it will provide an additional £15 million in hardship funding this financial year so that universities can provide extra support to students that need it most.

It builds on the significant £261 million that the government has already provided to the Office for Students (OfS) for the 2022/23 academic year which universities can draw upon to boost their own hardship funds.

Universities are responsible for ensuring students who need help get the support they need, including through their own hardship funds, or through bursaries and scholarships. Many universities have stepped up their efforts this year offering innovative schemes to support their students. Examples include:

The University of Southampton which has made a total of £1.1 million in the current academic year available to students to cover emergency costs,
  Queen Mary University of London which has a bursary scheme automatically provided to any domestic undergraduate from a family whose annual taxable income is below £20,000, and
  The University of York which announced that £150 would be given to student households who are finding it difficult to pay their bills as part of a £6 million package to support students most in need.
The government has also confirmed today that loans and grants to support undergraduate and postgraduate students with living and other costs will be increased by 2.8% for the 2023/24 academic year.

Minister for Skills, Apprenticeships and Higher Education Robert Halfon said:


  University is an investment, setting students up for future success, helping them to climb
the ladder of opportunity and gain invaluable skills for the world of work.

  We recognise students continue to face financial challenges, which is why we are
increasing loans and grants for living and other costs for a further year.  For the sixth year
in a row, we have frozen tuition fees for a full-time undergraduate course at a maximum of
£9,250 which will reduce the initial amount of debt students will take on.

  To support universities to top up their own hardship funds we are also making an
additional £15 million available. This will bring the total available to universities to draw on
in supporting their students in hardship to £276 million this academic year.

  I’m really pleased to see that so many universities are already stepping up efforts to
support their students through a variety of programmes. These schemes have already
helped students up and down the country and I urge anyone who is worried about their
circumstances to speak to their university.


For the sixth year in a row, the government has confirmed it will freeze tuition fees for a standard full-time course in the 2023/24 and 2024/25 academic year in England at a maximum of £9,250. This move will help provide better value for students by reducing the initial amount of debt students will take on.

The government regularly monitors the interest rates set on student loans against the interest rates prevailing on the market (PMR) for comparable loans. The government confirmed that the maximum Plan 2 and the Postgraduate loan interest rate will be 6.5% between 1 December 2022 and 28 February 2023.

From the 2023/24 academic year, the government will cut interest rates for new students to RPI only so that, under these terms, graduates will not repay more than they originally borrowed, when adjusted for inflation.
"
