dates,titles,text
20/05/2022,Biggest funding package in a generation to tackle youth offending and cut crime.,"
    
          

new ‘Turnaround’ scheme to catch troubled young people teetering on edge of criminality
  up to 20,000 more children and young people to be helped over next 3 years


Thousands of troubled children and teenagers teetering on the edge of crime will be put back on the right track thanks to the largest youth justice funding boost in a generation – cutting crime and making streets safer.

Around 80 percent of prolific adult offenders begin committing crimes as children, and the estimated cost of late intervention to the economy is nearly £17 billion per year.

That’s why the government is making the biggest investment in a generation – worth £300 million over the next 3 years – to support every single council across England and Wales in catching and preventing youth offending earlier than ever, helping to stop these children and teenagers from moving on to further, more serious offending.

And for the first time ever, local authorities will be given specific cash to intervene early with teenagers displaying signs such as poor school attendance, troubles at home, and a history of substance abuse which are known to be factors which often drive young people into crime – so they can steer them away from law-breaking before an offence is even committed.

Through ‘Turnaround’, a new early intervention scheme backed by £60 million, local Youth Offending Teams will be given extra funding to connect children and teenagers to targeted, wraparound support to stop them going down a path of criminality.

This could include mentoring, extra school tuition, sports clubs, help to address any issues at school or at home, with their mental health or with substance misuse, tackling the root causes of their behaviour and helping them to get their lives back on track.

Funding will also be used to bolster the day-to-day running of youth justice schemes and initiatives across the country, as well as support the work of the 20,000 additional police officers the government is committed to recruiting.

As part of today’s news, the Deputy Prime Minister, Dominic Raab, visited a community boxing scheme in Blackpool that is giving local children and teenagers an alternative to anti-social behaviour, giving them skills such as discipline and teamwork, and steering them away from potential offending and back into education and training.

Deputy Prime Minister, Lord Chancellor, and Secretary of State for Justice Dominic Raab said:


  Diverting more young people from gangs, drugs and violence will make our streets safer.
So, we’re investing £300 million in preventative initiatives, to deter criminal behaviour.

  Our plan will ensure thousands more young people can turn their lives around - which will transform their lives and make our communities safer.


Minister for Youth Justice Victoria Atkins said:


  Youth offending is a destructive force that blights communities and rips families apart.

  This vital new funding will help us stop youth crime in its tracks by ensuring these children stay in education and rebuild ties with their families, helping us build safer, more prosperous communities.


Youth Justice Board Chair Keith Fraser said:


  This is a smart and insightful investment by the government. If our youth justice teams are well-resourced to help children and families, we all benefit - from healthier, happier, safer children and from safer communities with fewer victims.

  This investment highlights the importance of their work and is a huge opportunity for youth justice teams across England and Wales. I hope they feel rightly proud of the contribution they make to the safety of communities and the lives of children.



Ministers estimate that the Turnaround programme will reach up to 20,000 more children over three years who would not otherwise have received support to turn away from offending.

While many local authorities already run successful early intervention programmes, by providing funding over a three-year period, councils will have greater certainty and be able to plan longer-term – ultimately steering more children and teenagers than ever away from crime.

Ministers will also set out plans in due course to improve how funding is targeted to local authorities, to ensure funding reaches areas who need it most and to ensure local authorities’ interventions are effective.


"
10/12/2021,"The people of Leicestershire are being invited to choose the name of its new jail in Glen Parva, Prisons Minister Victoria Atkins announced today (10 December 2021).","
    
          

community competition launched to name new prison
  more than 600 jobs to be created in boost to Leicestershire economy
  jail part of the government’s £4 billion programme to modernise prisons and cut crime


All residents are encouraged to send in name suggestions for the new 1,700-place jail, set to open in 2023, that embrace the history and culture of the area.

Earlier this week, the government set out its strategy on how modern jails – like the one in Glen Parva - will cut reoffending and protect the public by giving prisoners the education, skills and addiction support they need to live crime-free lives.

The development is part of a £4 billion programme that will see 20,000 additional prison places created by the mid-2020s.

The site has already created 230 jobs and 16 apprenticeships during construction and when open, it is expected to offer more than 600 jobs – providing a significant boost to the local economy.

Prisons Minister Victoria Atkins, said:


  We want our new, modern prison in Glen Parva to be rooted in its community. That’s why we are extending an invitation to local people to help choose its name.

  The prison will create hundreds of jobs when open - giving a major boost to the local economy and helping to protect the public.


The names will be narrowed down to a shortlist of potential options, with a panel of local representatives deciding on the final winner.

The name must then be formally agreed by Her Majesty The Queen, the Secretary of State for Justice Dominic Raab, and the Prisons Minister.

This follows a similar competition launched in Wellingborough (Northamptonshire), where another jail is due to open early next year.

In October 2020, it was revealed that ‘HMP Five Wells’ was chosen by the local community in Wellingborough, paying homage to the five historic wells surrounding the town and which appear on its coat of arms.

Construction of the new category C prison at Glen Parva began in August 2020 and is being built on the site of the previous HMP/YOI Glen Parva, which closed in 2017.

Note to editors

The scheme to name the new prison in Glen Parva is at no cost to the taxpayer.
  Those interested in taking part can send their entries to glenparvaenquiries@justice.gov.uk by Friday 21 January 2022.
"
14/12/2020,The Private International Law Bill (2020) received royal assent today (14 December 2020) allowing the UK to implement vital agreements which protect the country’s businesses and citizens across borders.,"
    
          

Bill allows UK to implement its own Private International Law agreements
  10-year strategy to capitalise on this new freedom published shortly


These agreements help to resolve a range of legal disputes – from returning children abducted by a parent, settling international business disagreements, to helping prevent a spouse living abroad dodging child maintenance obligations.

A public consultation on a 10-year strategy which seeks to capitalise on the UK’s regained capability in this area of law will be published shortly.

It will provide a blueprint for maintaining Britain’s status as a leading global jurisdiction for businesses to operate in, by giving them the legal certainty they need.  It will also ensure that consumers and families have access to the most effective ways of resolving disputes in an ever-more globalised world.

Lord Chancellor Robert Buckland said:


  These agreements provide vital protections to UK businesses, individuals and families looking to live, work, travel and trade across borders.

  We can now enjoy the freedom of being able to strike and implement our own Private International Law deals, ensuring they continue to have the interests of UK citizens at heart.


Without the ability to implement these agreements in domestic law, there could be parallel court cases in different countries, leading to conflicting decisions where UK individuals, businesses and families would bear the brunt of legal costs.

The Bill also maintains three key existing agreements, known as Hague Conventions, to ensure their clear implementation at the end of the transition period on 31 December 2020, and will enable the implementation of the Lugano Convention 2007, should the UK’s application to re-join it be successful. 

It provides an overarching legislative framework, enabling individual private international law (PIL) agreements to be implemented via secondary legislation now the UK has left the EU.

Notes to editors

The Private International Law Bill (2020) received Royal Assent today. It allows the UK to secure its own Private International Law (PIL) agreements now the UK has left the EU.
  PIL agreements cover aspects of civil, family and commercial law, with a real and lasting impacts on people’s lives. PIL agreements could mean, for example
    child maintenance obligations imposed in one country can be recognised and enforced in another
      UK citizens can have confidence that if they travel, buy goods or have an accident abroad there is a way to resolve any legal disputes that may arise.
      businesses can feel confident entering into cross-border transactions, knowing that in the event of a dispute, there is a clear framework of rules for resolving it
      divorces can be recognised in other countries
      children abducted by one of their parents can be returned to their home country, and
      businesses can feel confident entering into cross-border transactions, knowing that in the event of a dispute, there is a clear framework of rules for resolving it.
    
  Beyond underpinning future deals, the Bill simplifies the implementation of three existing Hague Conventions at the end of the Transition Period:
    1996 Hague Convention on Jurisdiction, Applicable Law, Recognition, Enforcement and Co-operation in Respect of Parental Responsibility and Measures for the Protection of Children: Helps resolve issues around residence and contact with children where parents live in different countries
      2005 Hague Convention on Choice of Court Agreements: Offers legal certainty in some cross-border contractual disputes by deciding which court should hear a case and enabling the decision to be recognised and enforced in another country
      2007 Hague Convention on the International Recovery of Child Support and Other Forms of Family Maintenance: Guarantees international recovery of child support and other forms of family maintenance across borders.
    
  A public consultation on a 10-year strategy for Private International Law will be published shortly.
"
12/03/2021,The CMA has today launched a study of children’s social care provision to establish why a lack of availability and increasing costs could be leading to the needs of children in care not being met.,"
    
          


    the study will examine the lack of availability and increasing costs in children’s social care provision, including children’s homes and fostering
  
  
    using its powers, the CMA is in a unique position to lift the lid on this complex sector and find solutions to problems it uncovers
  
  
    “Children’s care is not a market like any other - our clear and overriding priority will be about identifying ways children can get better care.” CEO Andrea Coscelli
  


The Competition and Markets Authority (CMA) will examine concerns around high prices paid by local authorities and inadequate supply of appropriate placements for children in their care. This could be putting pressure on the ability of local authorities to provide the appropriate accommodation and care which children need.

Using its statutory market study powers, the CMA aims to obtain information to help build a better understanding of the children’s social care sector. Depending on what it finds, it can issue guidance to businesses and the public, make recommendations to the industry or to government or, if appropriate, launch a full investigation into the market.

Andrea Coscelli, Chief Executive of the CMA, said:


  Children in care are among the most vulnerable in our society and they need a system that does not let them down.



  We are concerned that some children are not getting access to the right placements due to a lack of availability in the system, and that rising prices are putting further pressure on stretched local authority budgets.



  The CMA is in a unique position to use its powers to look into this. But children’s care is not a market like any other - our clear and overriding priority will be about identifying ways children can get better care. This will include examining the concerns raised about the role of private sector providers, which has grown in the last few years, as well as the role of public and third sector providers.


In England, Scotland and Wales, around 99,000 children live under the care of their local authority. The majority of children in care, approximately 65,000, live in foster care. Around 16,000 children live in residential care, including children’s homes and independent or semi-independent living accommodation, with the remaining 18,000 in a range of other types of placement, including with their parents or placed for adoption.

Each local authority is responsible for contracting foster care and purchasing the required children’s homes places. Children are placed with foster carers, either directly by the local authority or by independent fostering agencies, which can be run for-profit in England and Wales but not in Scotland. Children’s homes are provided either directly by local authorities, by the private sector or by charities, with 70% of children in England and 78% of children in Wales placed in private sector homes.

The launch of the study comes after concerns have been raised by other organisations about private sector provision of children’s social care making high profit margins. A recent Local Government Association report found that some independent providers of children’s residential and fostering placements are achieving profits of more than 20% on their income. The study will examine whether high levels of profit have been made at the expense of investment in recruiting and retaining staff, and providing quality services.

The CMA will look at how well the current system of provision is working across England, Scotland and Wales and explore how it could be made to work better. In particular, it will look into:


    the supply of placements, including whether the current balance of local authority, private sector and third sector provision is working well for children and local authorities
  
  
    prices charged by providers and variation between prices paid for similar types of placement, with increasing prices potentially putting pressure on local authority budgets
  
  
    the way commissioning of places is carried out, and whether local authorities could be more effective in securing appropriate placements for children
  
  
    the environment for investing in the system to ensure sufficient appropriate places are available for all children who need them in the future, and whether any measures should be taken to improve this
  
In recent years, the CMA has carried out similar studies into funerals and care homes for older people, among others.

Comments on the issues raised can be submitted in the Invitation to Comment by 14 April 2021. All updates on the CMA’s work in this area can be found on the Children’s social care study page.

Notes for editors


    Market studies, like this one, may lead to a range of outcomes, including: (a) clean bill of health (b) actions which improve the quality and accessibility of information to consumers (c) taking consumer or competition law enforcement action (d) making recommendations to the government to change regulations or public policy (e) encouraging businesses in the market to self-regulate (f) making a reference for a more in-depth (phase 2) market investigation, or (g) accepting formal undertakings in lieu of a reference
  
  
    Costs charged to local councils for independent provision of children’s homes has increased by 40% from £2841 per week on average in 2013 to £3970 per week on average in 2019, according to data from the National Centre for Excellence in Residential Childcare.
  
  
    Recent reports by the NAO, HCLG Select Committee and Children’s Commissioner have been critical of public policy on children’s social care.
  
  
    The largest proportion of children’s homes places in England and Wales are provided by the for-profit sector – around 70% in England and 78% in Wales in February 2020. In England, there has been a 19% increase in for-profit provision since 2016 (based on 2019 data). In England and Wales, independent fostering agencies (IFAs) provide 18% of placements, but in Scotland it is prohibited to run a fostering agency on a for-profit basis.
  
  
    A report published in January 2021 by the Local Government Association and Revolution Consulting, Profit making and Risk in Independent Children’s Social Care Placement Providers, found that some large private providers were achieving profits of 20.6% on their income.
  
  
    The children’s social care system is the subject of significant policy attention across the UK, including through the independent review of children’s social care in England, the implementation of the Promise review recommendations in Scotland and the Improving Outcomes for Children programme in Wales. The CMA’s study will take into account the policy context of each nation.
  
"
03/12/2020,An extra £68 million will help thousands more disabled people to access grants to improve their homes so they can live independently.,"
    
          

Extra £68 million to help adapt homes for people with disabilities in England
  More than 280,000 home adaptions provided through the Disabled Facilities Grant
  Details of £4 billion Better Care Fund confirmed to better integrate health and social care


An extra £68 million will help thousands more disabled people to access grants to improve their homes so they can live independently, Minister for Rough Sleeping and Housing Kelly Tolhurst has announced today (3 December 2020), the International Day of People with Disabilities.

The additional funding for councils will help people make the adaptations they need to live safely and independently in their own homes.

The Disabled Facilities Grant funding can be used towards the costs of home adaptations such as stair-lifts, level access showers, wet rooms, winches, grab rails and ramps. These can play a critical role in avoiding the need for hospital or care home admission, as well as helping to speed-up discharge from hospital.

This funding is in addition to the £505 million paid to councils in May 2020, increasing the overall government investment in the Disabled Facilities Grant to £573 million this year.

With Spending Review 2020 investment of £573 million in the Disabled Facilities Grant for 2021 to 2022, government has now confirmed over £4 billion funding for the grant since 2010.

This is part of the government’s comprehensive programme to better integrate health and social care services. Today details of the £4 billion Better Care Fund were also confirmed – setting out how councils may use this funding to deliver effective care and support for people in their communities.

Minister for Rough Sleeping and Housing, Kelly Tolhurst said:


  I’m pleased that extra funding announced today, on the International Day of People with Disabilities, will see thousands more people benefit.  This grant can be literally life changing and lengthening, helping more people to live independently in their own homes.

  Since 2012 over 280,000 home adaptions have been funded through the Disabled Facilities Grant Scheme helping many tens of thousands of people to live at home independently.


Minister for Care, Helen Whately said:


  This grant will help hundreds of thousands of disabled people across England to live more independently in their own homes and improve their quality of life.

  I know this year has been incredibly difficult for disabled people in particular and I’m pleased that, on the International Day of People with Disabilities, we’re able to provide this additional funding.

  The Disabled Facilities Grant is a really important part of our ambition to reduce health inequalities and support more people to live healthy, independent lives for as long as possible.


The Disabled Facilities Grant forms part of the Better Care Fund, a fund which brings together local government and health partners to jointly plan and pool budgets to support integrated care.

The COVID-19 pandemic has demonstrated how health and social care systems can come together and focus on the public’s health and care needs. This announcement is part of the government’s ongoing work to address disparities across society, and its commitment to ensuring that health and care systems work effectively together at a local level, and the Better Care Fund is a key part of this integration.


  
    
    Office address and general enquiries
    
      
2 Marsham Street

LondonSW1P 4DF


    
    
      
      
        
          Email
          correspondence@communities.gov.uk
        
      
      
      
        
          General enquiries:  please use this number if you are a member of the public
          030 3444 0000
        
      
      
    
    
      If your enquiry is related to COVID-19 please check our guidance page first before you contact us - https://www.gov.uk/guidance/coronavirus-covid-19-guidance-for-local-government.If you still need to contact us please use the contact form above to get in touch, because of coronavirus (COVID-19). If you send it by post it will not receive a reply within normal timescale.
    
    
  



  
    
    Media enquiries
    
    
      
      
        
          Email
          newsdesk@communities.gov.uk
        
      
      
      
        
          Please use this number if you are a journalist wishing to speak to Press Office
          0303 444 1209
        
      
      
    
    
    
  



  
    
    Social media - MHCLG
    
    
    
      Twitter - https://twitter.com/mhclgFlickr - http://www.flickr.com/photos/mhclgLinkedIn - http://www.linkedin.com/company/mhclg
    
    
  



"
